<Reisid xmlns:xsi="http://www.w3.org/2001/XMLSchema-instance"
        xsi:noNamespaceSchemaLocation="Reisid.xsd">
	<Reis id="1" reisi_number="0093-5289">
		<Firma>Marcq Airlines</Firma>
		<Sihtkoht>Amsterdam</Sihtkoht>
		<Lennujaamad kestus="3:15">
			<Valjumine>Salem Leckrone Airport</Valjumine>
			<Saabumine>Schiphol Airport</Saabumine>
		</Lennujaamad>
		<Transport tuup="Lennureis" value="100"/>
		<Majutus value="250"/>
		<Ekskursioonid value="50"/>
		<MuudKulud value="30"/>
		<Hind value="7.99"/>
	</Reis>

	<Reis id="2" reisi_number="1023-8451">
		<Firma>Escoffrey Air</Firma>
		<Sihtkoht>New York</Sihtkoht>
		<Lennujaamad kestus="8:30">
			<Valjumine>London Heathrow Airport</Valjumine>
			<Saabumine>JFK International Airport</Saabumine>
		</Lennujaamad>
		<Transport tuup="Lennureis" value="350"/>
		<Majutus value="400"/>
		<Ekskursioonid value="120"/>
		<MuudKulud value="70"/>
		<Hind value="49.99"/>
	</Reis>

	<Reis id="3" reisi_number="5843-1112">
		<Firma>Treacher Flights</Firma>
		<Sihtkoht>Berlin</Sihtkoht>
		<Lennujaamad kestus="2:00">
			<Valjumine>Warsaw Chopin Airport</Valjumine>
			<Saabumine>Berlin Brandenburg Airport</Saabumine>
		</Lennujaamad>
		<Transport tuup="Rong" value="80"/>
		<Majutus value="150"/>
		<Ekskursioonid value="60"/>
		<MuudKulud value="25"/>
		<Hind value="19.99"/>
	</Reis>

	<Reis id="4" reisi_number="9876-4532">
		<Firma>Giscken Airways</Firma>
		<Sihtkoht>Chicago</Sihtkoht>
		<Lennujaamad kestus="9:15">
			<Valjumine>Frankfurt Main Airport</Valjumine>
			<Saabumine>O'Hare International Airport</Saabumine>
		</Lennujaamad>
		<Transport tuup="Lennureis" value="420"/>
		<Majutus value="390"/>
		<Ekskursioonid value="100"/>
		<MuudKulud value="80"/>
		<Hind value="59.99"/>
	</Reis>

	<Reis id="5" reisi_number="7651-2248">
		<Firma>Duckhouse Travel</Firma>
		<Sihtkoht>Paris</Sihtkoht>
		<Lennujaamad kestus="5:45">
			<Valjumine>Rome Fiumicino Airport</Valjumine>
			<Saabumine>Charles de Gaulle Airport</Saabumine>
		</Lennujaamad>
		<Transport tuup="Rong" value="120"/>
		<Majutus value="200"/>
		<Ekskursioonid value="80"/>
		<MuudKulud value="40"/>
		<Hind value="29.99"/>
	</Reis>

	<Reis id="6" reisi_number="3012-6541">
		<Firma>Gertray Express</Firma>
		<Sihtkoht>Seoul</Sihtkoht>
		<Lennujaamad kestus="11:00">
			<Valjumine>San Francisco Airport</Valjumine>
			<Saabumine>Incheon International Airport</Saabumine>
		</Lennujaamad>
		<Transport tuup="Lennureis" value="600"/>
		<Majutus value="500"/>
		<Ekskursioonid value="200"/>
		<MuudKulud value="150"/>
		<Hind value="89.99"/>
	</Reis>

	<Reis id="7" reisi_number="2220-7890">
		<Firma>Brocklesby Air</Firma>
		<Sihtkoht>Helsinki</Sihtkoht>
		<Lennujaamad kestus="2:20">
			<Valjumine>Stockholm Arlanda Airport</Valjumine>
			<Saabumine>Helsinki Vantaa Airport</Saabumine>
		</Lennujaamad>
		<Transport tuup="Laev" value="70"/>
		<Majutus value="130"/>
		<Ekskursioonid value="40"/>
		<MuudKulud value="20"/>
		<Hind value="15.99"/>
	</Reis>

	<Reis id="8" reisi_number="7412-9510">
		<Firma>Medina Airlines</Firma>
		<Sihtkoht>Lima</Sihtkoht>
		<Lennujaamad kestus="14:30">
			<Valjumine>Madrid Barajas Airport</Valjumine>
			<Saabumine>Jorge Chávez International Airport</Saabumine>
		</Lennujaamad>
		<Transport tuup="Lennureis" value="750"/>
		<Majutus value="600"/>
		<Ekskursioonid value="250"/>
		<MuudKulud value="180"/>
		<Hind value="109.99"/>
	</Reis>

	<Reis id="9" reisi_number="1156-4789">
		<Firma>Nordic Travels</Firma>
		<Sihtkoht>Oslo</Sihtkoht>
		<Lennujaamad kestus="1:40">
			<Valjumine>Copenhagen Airport</Valjumine>
			<Saabumine>Oslo Gardermoen Airport</Saabumine>
		</Lennujaamad>
		<Transport tuup="Rong" value="60"/>
		<Majutus value="140"/>
		<Ekskursioonid value="45"/>
		<MuudKulud value="25"/>
		<Hind value="12.99"/>
	</Reis>

	<Reis id="10" reisi_number="9810-2221">
		<Firma>Atlantic Lines</Firma>
		<Sihtkoht>London</Sihtkoht>
		<Lennujaamad kestus="7:20">
			<Valjumine>Boston Logan Airport</Valjumine>
			<Saabumine>London Gatwick Airport</Saabumine>
		</Lennujaamad>
		<Transport tuup="Lennureis" value="300"/>
		<Majutus value="260"/>
		<Ekskursioonid value="90"/>
		<MuudKulud value="60"/>
		<Hind value="39.99"/>
	</Reis>
	<Reis id="11" reisi_number="7782-4321">
		<Firma>EuroSky</Firma>
		<Sihtkoht>Barcelona</Sihtkoht>
		<Lennujaamad kestus="2:30">
			<Valjumine>Munich Airport</Valjumine>
			<Saabumine>Barcelona El Prat Airport</Saabumine>
		</Lennujaamad>
		<Transport tuup="Lennureis" value="140"/>
		<Majutus value="220"/>
		<Ekskursioonid value="70"/>
		<MuudKulud value="35"/>
		<Hind value="24.99"/>
	</Reis>

	<Reis id="12" reisi_number="6611-9843">
		<Firma>TransBaltic</Firma>
		<Sihtkoht>Tallinn</Sihtkoht>
		<Lennujaamad kestus="0:45">
			<Valjumine>Riga International Airport</Valjumine>
			<Saabumine>Lennart Meri Tallinn Airport</Saabumine>
		</Lennujaamad>
		<Transport tuup="Buss" value="30"/>
		<Majutus value="100"/>
		<Ekskursioonid value="25"/>
		<MuudKulud value="15"/>
		<Hind value="8.99"/>
	</Reis>

	<Reis id="13" reisi_number="3312-5487">
		<Firma>AsiaWings</Firma>
		<Sihtkoht>Tokyo</Sihtkoht>
		<Lennujaamad kestus="13:00">
			<Valjumine>Los Angeles International Airport</Valjumine>
			<Saabumine>Tokyo Haneda Airport</Saabumine>
		</Lennujaamad>
		<Transport tuup="Lennureis" value="800"/>
		<Majutus value="650"/>
		<Ekskursioonid value="300"/>
		<MuudKulud value="200"/>
		<Hind value="129.99"/>
	</Reis>

	<Reis id="14" reisi_number="9822-1150">
		<Firma>NordRail</Firma>
		<Sihtkoht>Vienna</Sihtkoht>
		<Lennujaamad kestus="1:30">
			<Valjumine>Prague Airport</Valjumine>
			<Saabumine>Vienna Airport</Saabumine>
		</Lennujaamad>
		<Transport tuup="Rong" value="65"/>
		<Majutus value="140"/>
		<Ekskursioonid value="50"/>
		<MuudKulud value="20"/>
		<Hind value="14.99"/>
	</Reis>

	<Reis id="15" reisi_number="5400-7621">
		<Firma>SkyJet</Firma>
		<Sihtkoht>Dubai</Sihtkoht>
		<Lennujaamad kestus="6:45">
			<Valjumine>Istanbul Airport</Valjumine>
			<Saabumine>Dubai International Airport</Saabumine>
		</Lennujaamad>
		<Transport tuup="Lennureis" value="270"/>
		<Majutus value="320"/>
		<Ekskursioonid value="110"/>
		<MuudKulud value="55"/>
		<Hind value="42.99"/>
	</Reis>

	<Reis id="16" reisi_number="2021-7743">
		<Firma>OceanLines</Firma>
		<Sihtkoht>Stockholm</Sihtkoht>
		<Lennujaamad kestus="6:00">
			<Valjumine>Helsinki Port</Valjumine>
			<Saabumine>Stockholm Port</Saabumine>
		</Lennujaamad>
		<Transport tuup="Laev" value="95"/>
		<Majutus value="180"/>
		<Ekskursioonid value="60"/>
		<MuudKulud value="30"/>
		<Hind value="17.99"/>
	</Reis>

	<Reis id="17" reisi_number="8876-3391">
		<Firma>Central Europe Air</Firma>
		<Sihtkoht>Brussels</Sihtkoht>
		<Lennujaamad kestus="1:15">
			<Valjumine>Paris Orly Airport</Valjumine>
			<Saabumine>Brussels Airport</Saabumine>
		</Lennujaamad>
		<Transport tuup="Rong" value="55"/>
		<Majutus value="150"/>
		<Ekskursioonid value="45"/>
		<MuudKulud value="20"/>
		<Hind value="12.49"/>
	</Reis>

	<Reis id="18" reisi_number="5550-1109">
		<Firma>FlyCanada</Firma>
		<Sihtkoht>Toronto</Sihtkoht>
		<Lennujaamad kestus="9:50">
			<Valjumine>Frankfurt Main Airport</Valjumine>
			<Saabumine>Toronto Pearson Airport</Saabumine>
		</Lennujaamad>
		<Transport tuup="Lennureis" value="430"/>
		<Majutus value="370"/>
		<Ekskursioonid value="120"/>
		<MuudKulud value="75"/>
		<Hind value="54.99"/>
	</Reis>

	<Reis id="19" reisi_number="6622-4890">
		<Firma>Polar Express</Firma>
		<Sihtkoht>Rovaniemi</Sihtkoht>
		<Lennujaamad kestus="1:20">
			<Valjumine>Helsinki Vantaa Airport</Valjumine>
			<Saabumine>Rovaniemi Airport</Saabumine>
		</Lennujaamad>
		<Transport tuup="Rong" value="85"/>
		<Majutus value="140"/>
		<Ekskursioonid value="60"/>
		<MuudKulud value="25"/>
		<Hind value="18.99"/>
	</Reis>

	<Reis id="20" reisi_number="9933-8450">
		<Firma>EastAir</Firma>
		<Sihtkoht>Beijing</Sihtkoht>
		<Lennujaamad kestus="10:30">
			<Valjumine>Paris Charles de Gaulle Airport</Valjumine>
			<Saabumine>Beijing Capital International Airport</Saabumine>
		</Lennujaamad>
		<Transport tuup="Lennureis" value="670"/>
		<Majutus value="520"/>
		<Ekskursioonid value="210"/>
		<MuudKulud value="140"/>
		<Hind value="99.99"/>
	</Reis>

	<Reis id="21" reisi_number="2200-7749">
		<Firma>EuroBus</Firma>
		<Sihtkoht>Warsaw</Sihtkoht>
		<Lennujaamad kestus="6:15">
			<Valjumine>Berlin Central Bus Station</Valjumine>
			<Saabumine>Warsaw Bus Station</Saabumine>
		</Lennujaamad>
		<Transport tuup="Buss" value="40"/>
		<Majutus value="100"/>
		<Ekskursioonid value="35"/>
		<MuudKulud value="15"/>
		<Hind value="9.99"/>
	</Reis>

	<Reis id="22" reisi_number="4432-1170">
		<Firma>Alpine Flights</Firma>
		<Sihtkoht>Zurich</Sihtkoht>
		<Lennujaamad kestus="1:50">
			<Valjumine>Vienna Airport</Valjumine>
			<Saabumine>Zurich Airport</Saabumine>
		</Lennujaamad>
		<Transport tuup="Lennureis" value="120"/>
		<Majutus value="190"/>
		<Ekskursioonid value="75"/>
		<MuudKulud value="40"/>
		<Hind value="21.99"/>
	</Reis>

	<Reis id="23" reisi_number="9910-2215">
		<Firma>Sahara Travel</Firma>
		<Sihtkoht>Cairo</Sihtkoht>
		<Lennujaamad kestus="4:20">
			<Valjumine>Rome Fiumicino Airport</Valjumine>
			<Saabumine>Cairo International Airport</Saabumine>
		</Lennujaamad>
		<Transport tuup="Lennureis" value="200"/>
		<Majutus value="210"/>
		<Ekskursioonid value="90"/>
		<MuudKulud value="50"/>
		<Hind value="34.99"/>
	</Reis>

	<Reis id="24" reisi_number="8871-9901">
		<Firma>NordSea Ferries</Firma>
		<Sihtkoht>Copenhagen</Sihtkoht>
		<Lennujaamad kestus="7:00">
			<Valjumine>Oslo Port</Valjumine>
			<Saabumine>Copenhagen Port</Saabumine>
		</Lennujaamad>
		<Transport tuup="Laev" value="85"/>
		<Majutus value="130"/>
		<Ekskursioonid value="40"/>
		<MuudKulud value="25"/>
		<Hind value="13.99"/>
	</Reis>

	<Reis id="25" reisi_number="1200-5400">
		<Firma>Southern Air</Firma>
		<Sihtkoht>Sydney</Sihtkoht>
		<Lennujaamad kestus="22:30">
			<Valjumine>Dubai International Airport</Valjumine>